<?xml version='1.0' encoding='UTF-8'?>
<definition xmlns:xsi="http://www.w3.org/2001/XMLSchema-instance" xsi:noNamespaceSchemaLocation="../../schemas/definition.xsd">
	<texts language='hu'>
		<title>Ember vs. MI</title>
		<description>Küzdelem a gép ellen. Három bolygóról indulva kell legyőzni az ellenfelet.</description>
	</texts>
	<texts language='en'>
		<title>Human vs. AI</title>
		<description>Fight against the machine. Starting with three planets you should defeat the adversary.</description>
	</texts>
	<texts language='fr'>
		<title>Human vs. AI</title>
		<description>Fight against the machine. Starting with three planets you should defeat the adversary.</description>
	</texts>
	<texts language='de'>
		<title>Human vs. AI</title>
		<description>Fight against the machine. Starting with three planets you should defeat the adversary.</description>
	</texts>
	<texts language='ru'>
		<title>Human vs. AI</title>
		<description>Fight against the machine. Starting with three planets you should defeat the adversary.</description>
	</texts>
	<image></image>
	<intro></intro>
	<level>5</level>
	<battle>campaign/main/battle</battle>
	<bridge>campaign/main/bridge</bridge>
	<buildings>campaign/main/buildings</buildings>
	<diplomacy>campaign/main/diplomacy</diplomacy>
	<galaxy>campaign/main/galaxy</galaxy>
	<planets>skirmish/human/planets</planets>
	<players>skirmish/human/players</players>
	<talks>campaign/main/talks</talks>
	<tech>skirmish/human/tech</tech>
	<test>campaign/main/test</test>
	<walks>campaign/main/walks</walks>
	<scripting>skirmish/human/scripting</scripting>
	<chats>campaign/main/chat</chats>
	<spies>campaing/main/spies</spies>
	<parameters		
	    groundRadarUnitSize="35" 
		fleetRadarUnitSize="25" 
		researchSpeed="8" 
		productionUnit="0.004" 
		constructionSpeed="20" 
		constructionCost="20" 
		repairSpeed="10" 
		repairCost="2" 
		costToHitpoints="10" 
		nearbyDistance="10" 
		simulationRatio="10" 
		fleetSpeed="0.0064" 
		stationLimit="3" 
		battleshipLimit="3" 
		fighterLimit="30" 
		mediumshipLimit="25"
		radarShareLimit="80"
		blackMarketRestockTime="4320"
/>
</definition>