<?xml version='1.0' encoding='UTF-8'?>
<definition xmlns:xsi="http://www.w3.org/2001/XMLSchema-instance" xsi:noNamespaceSchemaLocation="../../schemas/definition.xsd">
	<texts language='hu'>
		<title>Gummp891202 Race Mod</title>
		<description>Gummp891202 Race Mod, felturbózott idegen technológiákkal, kifejezetten egyéni játékra.</description>
	</texts>
	<texts language='en'>
		<title>Gummp891202 Race Mod</title>
		<description>Gummp891202 Race Mod with improved alien technologies, for skirmish play.</description>
	</texts>
	<image></image>
	<intro></intro>
	<level>5</level>
	<battle>skirmish/racemod-0.1/battle</battle>
	<bridge>campaign/main/bridge</bridge>
	<buildings>skirmish/racemod-0.1/buildings</buildings>
	<diplomacy>campaign/main/diplomacy</diplomacy>
	<galaxy>campaign/main/galaxy</galaxy>
	<planets>skirmish/racemod-0.1/planets</planets>
	<players>skirmish/racemod-0.1/players</players>
	<talks>campaign/main/talks</talks>
	<tech>skirmish/racemod-0.1/tech</tech>
	<test>campaign/main/test</test>
	<walks>campaign/main/walks</walks>
	<scripting>skirmish/racemod-0.1/scripting</scripting>
	<chats>campaign/main/chat</chats>
</definition>