<?xml version='1.0' encoding='UTF-8'?>
<definition xmlns:xsi="http://www.w3.org/2001/XMLSchema-instance" xsi:noNamespaceSchemaLocation="../../schemas/definition.xsd">
	<texts language='hu'>
		<title>Főkampány (szabad)</title>
		<description>Az eredeti Imperium Galactica főkampánya. Szabad játékmenet.</description>
	</texts>
	<texts language='en'>
		<title>Main Campaign (free)</title>
		<description>The main campaign of the original Imperium Galactica. Free gameplay.</description>
	</texts>
	<image>campaign/main/main_campaign_image</image>
	<intro>interlude/campaign_start</intro>
	<level>5</level>
	<battle>campaign/main/battle</battle>
	<bridge>campaign/main/bridge</bridge>
	<buildings>campaign/main/buildings</buildings>
	<diplomacy>campaign/main/diplomacy</diplomacy>
	<galaxy>campaign/main/galaxy</galaxy>
	<planets>campaign/main/planets</planets>
	<players>campaign/main/players</players>
	<talks>campaign/main/talks</talks>
	<tech>campaign/main/tech</tech>
	<test>campaign/main/test</test>
	<walks>campaign/main/walks</walks>
	<scripting>skirmish/human/scripting</scripting>
	<chats>campaign/main/chat</chats>
</definition>