<?xml version='1.0' encoding='UTF-8'?>
<definition xmlns:xsi="http://www.w3.org/2001/XMLSchema-instance" xsi:noNamespaceSchemaLocation="../../schemas/definition.xsd">
	<texts language='hu'>
		<title>Főkampány (szabad)</title>
		<description>Az eredeti Imperium Galactica főkampánya. Szabad játékmenet.</description>
	</texts>
	<texts language='en'>
		<title>Main Campaign (free)</title>
		<description>The main campaign of the original Imperium Galactica. Free gameplay.</description>
	</texts>
	<texts language='fr'>
		<title>Main Campaign (free)</title>
		<description>The main campaign of the original Imperium Galactica. Free gameplay.</description>
	</texts>
	<texts language='de'>
		<title>Main Campaign (free)</title>
		<description>The main campaign of the original Imperium Galactica. Free gameplay.</description>
	</texts>
	<texts language='ru'>
		<title>Main Campaign (free)</title>
		<description>The main campaign of the original Imperium Galactica. Free gameplay.</description>
	</texts>
	<image>campaign/main/main_campaign_image</image>
	<intro>interlude/campaign_start</intro>
	<level>5</level>
	<battle>campaign/main/battle</battle>
	<bridge>campaign/main/bridge</bridge>
	<buildings>campaign/main/buildings</buildings>
	<diplomacy>campaign/main/diplomacy</diplomacy>
	<galaxy>campaign/main/galaxy</galaxy>
	<planets>campaign/main/planets</planets>
	<players>campaign/main2/players</players>
	<talks>campaign/main/talks</talks>
	<tech>campaign/main/tech</tech>
	<test>campaign/main/test</test>
	<walks>campaign/main/walks</walks>
	<scripting>skirmish/human/scripting</scripting>
	<chats>campaign/main/chat</chats>
	<spies>campaign/main/spies</spies>
	<parameters 
		groundRadarUnitSize="35" 
		fleetRadarUnitSize="25" 
		researchSpeed="8" 
		productionUnit="0.004" 
		constructionSpeed="20" 
		constructionCost="20" 
		repairSpeed="10" 
		repairCost="2" 
		costToHitpoints="10" 
		nearbyDistance="10" 
		simulationRatio="10" 
		fleetSpeed="0.0064" 
		stationLimit="3" 
		battleshipLimit="3" 
		fighterLimit="30" 
		mediumshipLimit="25"
		radarShareLimit="80"
		blackMarketRestockTime="4320"
	/>
</definition>